{
  "title": "Je aanvraag voor een energielabeladviseur staat nog open",
  "subject_line": "Wat is de volgende stap voor een zuiniger huis?",
  "preheader": "Energielabel geregeld of nog bezig? Van bouwkundige keuring tot isolatie en warmtepomp.",
  "hero_link_url": "https://trustoo.nl/nederland/energielabel-adviseur/?utm_source=brevo&utm_campaign=reactivatie_energielabel_adviseur_mail1&utm_medium=email&utm_content=heroimage",
  "hero_image_url": "https://img.mailinblue.com/9986607/images/rnb/original/6a99ca6625aaba004d88df8e.jpg",
  "hero_image_alt": "Energielabeladviseur aan het werk: isolatie en raam controleren",
  "hero_title_pre": "Je aanvraag voor een",
  "hero_title_accent": "energielabeladviseur",
  "hero_title_post": "staat nog open",
  "hero_subtitle": "Een paar maanden geleden zocht je via Trustoo een energielabeladviseur. Nog niemand gevonden? Voeg extra energielabeladviseurs toe en ontvang nieuwe offertes om te vergelijken.",
  "hero_cta_label": "Ontvang nieuwe offertes",
  "campaign_key": "reactivatie_energielabel_adviseur_mail1",
  "request_label": "Je openstaande aanvraag",
  "request_service": "Energielabeladviseur",
  "request_meta": "Een paar maanden geleden aangevraagd via Trustoo",
  "request_status": "Nog open",
  "cta_label": "Aanvraag sluiten",
  "cta_note": "",
  "services_heading_pre": "Nog meer",
  "services_heading_accent": "vakmensen",
  "services_heading_post": "nodig?",
  "services_intro": "Via Trustoo vind je ook andere vakmensen die handig kunnen zijn naast een energielabeladviseur. Vergelijk beoordelingen van anderen en vraag gratis offertes aan.",
  "service1_name": "Bouwkundige keurders",
  "service1_text": "Schakel een bouwkundige keurder in om een woning onafhankelijk te beoordelen.",
  "service1_url": "https://trustoo.nl/nederland/bouwkundige-keuring/?utm_source=brevo&utm_campaign=reactivatie_energielabel_adviseur_mail1&utm_medium=email&utm_content=bouwkundigekeuringcard",
  "service1_link_label": "Bekijk bouwkundig keurders",
  "service1_image_url": "https://img.mailinblue.com/9986607/images/rnb/original/6a99ca5ed6d15096d2e48ab2.jpg",
  "service1_image_alt": "Bouwkundig inspecteur aan het werk: muur en kozijn inspecteren",
  "service2_name": "Isolatiebedrijven",
  "service2_text": "Vraag een isolatiebedrijf om advies over dak-, muur- of vloerisolatie.",
  "service2_url": "https://trustoo.nl/nederland/isolatie/?utm_source=brevo&utm_campaign=reactivatie_energielabel_adviseur_mail1&utm_medium=email&utm_content=isolatiecard",
  "service2_link_label": "Bekijk isolatiebedrijven",
  "service2_image_url": "https://img.mailinblue.com/9986607/images/rnb/original/6a99ca7725aaba004d88df92.jpg",
  "service2_image_alt": "Isolatiespecialist aan het werk: isolatiemateriaal aanbrengen",
  "service3_name": "Warmtepompinstallateurs",
  "service3_text": "Laat een warmtepomp plaatsen die past bij je woning en energieverbruik.",
  "service3_url": "https://trustoo.nl/nederland/warmtepomp-installateur/?utm_source=brevo&utm_campaign=reactivatie_energielabel_adviseur_mail1&utm_medium=email&utm_content=warmtepompinstallateurcard",
  "service3_link_label": "Bekijk warmtepompinstallateurs",
  "service3_image_url": "https://img.mailinblue.com/9986607/images/rnb/original/6a99ca9cb423db7c1ead99be.jpg",
  "service3_image_alt": "Warmtepompinstallateur aan het werk: warmtepomp aansluiten",
  "closing_heading_pre": "Al geregeld of liever",
  "closing_heading_accent": "opnieuw beginnen?",
  "closing_heading_post": "",
  "closing_intro": "Heb je gevonden wat je zocht? Rond je aanvraag af, zodat bedrijven niet meer hoeven te reageren. Liever opnieuw beginnen? Start een nieuwe aanvraag.",
  "done_link_label": "Aanvraag afronden",
  "new_request_url": "https://trustoo.nl/nederland/energielabel-adviseur/?utm_source=brevo&utm_campaign=reactivatie_energielabel_adviseur_mail1&utm_medium=email&utm_content=nieuweaanvraagcta",
  "new_request_label": "Nieuwe aanvraag doen"
}
