{
  "title": "Je aanvraag voor een bouwkundige keurder staat nog open",
  "subject_line": "Nog op zoek naar een bouwkundige keurder? Je aanvraag staat nog open",
  "preheader": "Voeg met één klik extra bouwkundige keurders toe aan je aanvraag en ontvang nieuwe offertes. Of rond je aanvraag af als je al iemand hebt gevonden.",
  "hero_link_url": "https://trustoo.nl/nederland/bouwkundige-keuring/?utm_source=brevo&utm_campaign=reactivatie_bouwkundige_keuring_mail1&utm_medium=email&utm_content=heroimage",
  "hero_image_url": "https://img.mailinblue.com/9986607/images/rnb/original/6a99ca5ed6d15096d2e48ab2.jpg",
  "hero_image_alt": "Bouwkundig inspecteur aan het werk: muur en kozijn inspecteren",
  "hero_title_pre": "Je aanvraag voor een",
  "hero_title_accent": "bouwkundige keurder",
  "hero_title_post": "staat nog open",
  "hero_subtitle": "Een paar maanden geleden zocht je via Trustoo een bouwkundige keurder. Nog niemand gevonden? Voeg extra bouwkundige keurders toe en ontvang nieuwe offertes om te vergelijken.",
  "hero_cta_label": "Ontvang nieuwe offertes",
  "campaign_key": "reactivatie_bouwkundige_keuring_mail1",
  "request_label": "Je openstaande aanvraag",
  "request_service": "Bouwkundige keurder",
  "request_meta": "Een paar maanden geleden aangevraagd via Trustoo",
  "request_status": "Nog open",
  "cta_label": "Aanvraag sluiten",
  "cta_note": "",
  "services_heading_pre": "Nog meer",
  "services_heading_accent": "vakmensen",
  "services_heading_post": "nodig?",
  "services_intro": "Via Trustoo vind je ook andere vakmensen die handig kunnen zijn naast een bouwkundige keurder. Vergelijk beoordelingen van anderen en vraag gratis offertes aan.",
  "service1_name": "Aankoopmakelaars",
  "service1_text": "Kies een aankoopmakelaar voor hulp bij zoeken, bieden en onderhandelen.",
  "service1_url": "https://trustoo.nl/nederland/aankoopmakelaar/?utm_source=brevo&utm_campaign=reactivatie_bouwkundige_keuring_mail1&utm_medium=email&utm_content=aankoopmakelaarcard",
  "service1_link_label": "Bekijk aankoopmakelaars",
  "service1_image_url": "https://img.mailinblue.com/9986607/images/rnb/original/6a99ca52be55c06bad68f869.jpg",
  "service1_image_alt": "Aankoopmakelaar aan het werk: woning inspecteren met kopers",
  "service2_name": "Taxateurs",
  "service2_text": "Vraag een onafhankelijk gevalideerd taxatierapport aan voor koop of hypotheek.",
  "service2_url": "https://trustoo.nl/nederland/taxateur/?utm_source=brevo&utm_campaign=reactivatie_bouwkundige_keuring_mail1&utm_medium=email&utm_content=taxateurcard",
  "service2_link_label": "Bekijk taxateurs",
  "service2_image_url": "https://img.mailinblue.com/9986607/images/rnb/original/6a99ca9eb423db7c1ead99c0.jpg",
  "service2_image_alt": "Woningtaxateur aan het werk: woning opnemen en notities maken",
  "service3_name": "Hypotheekadviseurs",
  "service3_text": "Laat berekenen wat je kunt lenen en vergelijk hypotheken met onafhankelijk advies.",
  "service3_url": "https://trustoo.nl/nederland/hypotheekadviseur/?utm_source=brevo&utm_campaign=reactivatie_bouwkundige_keuring_mail1&utm_medium=email&utm_content=hypotheekadviseurcard",
  "service3_link_label": "Bekijk hypotheekadviseurs",
  "service3_image_url": "https://img.mailinblue.com/9986607/images/rnb/original/6aaa43ab51ca571010aeccb7.jpg",
  "service3_image_alt": "Hypotheekadviseur aan het werk: hypotheekopties bespreken met een stel",
  "closing_heading_pre": "Al geregeld of liever",
  "closing_heading_accent": "opnieuw beginnen?",
  "closing_heading_post": "",
  "closing_intro": "Heb je gevonden wat je zocht? Rond je aanvraag af, zodat bedrijven niet meer hoeven te reageren. Liever opnieuw beginnen? Start een nieuwe aanvraag.",
  "done_link_label": "Aanvraag afronden",
  "new_request_url": "https://trustoo.nl/nederland/bouwkundige-keuring/?utm_source=brevo&utm_campaign=reactivatie_bouwkundige_keuring_mail1&utm_medium=email&utm_content=nieuweaanvraagcta",
  "new_request_label": "Nieuwe aanvraag doen"
}
