{
  "title": "Je aanvraag voor een zonnepaneleninstallateur staat nog open",
  "subject_line": "Wat is de volgende stap voor je eigen energie?",
  "preheader": "Zonnepanelen geregeld of nog bezig? Ontdek ook een thuisbatterij, laadpaal of elektricien.",
  "hero_link_url": "https://trustoo.nl/nederland/zonnepanelen/?utm_source=brevo&utm_campaign=reactivatie_zonnepanelen_mail1&utm_medium=email&utm_content=heroimage",
  "hero_image_url": "https://img.mailinblue.com/9986607/images/rnb/original/6a99ca9fb423db7c1ead99c1.jpg",
  "hero_image_alt": "Zonnepaneleninstallateur aan het werk: zonnepaneel op dak monteren",
  "hero_title_pre": "Je aanvraag voor",
  "hero_title_accent": "zonnepanelen",
  "hero_title_post": "staat nog open",
  "hero_subtitle": "Een paar maanden geleden zocht je via Trustoo een zonnepaneleninstallateur. Nog niemand gevonden? Voeg extra zonnepanelen-installateurs toe en ontvang nieuwe offertes om te vergelijken.",
  "hero_cta_label": "Ontvang nieuwe offertes",
  "campaign_key": "reactivatie_zonnepanelen_mail1",
  "request_label": "Je openstaande aanvraag",
  "request_service": "Zonnepaneleninstallateur",
  "request_meta": "Een paar maanden geleden aangevraagd via Trustoo",
  "request_status": "Nog open",
  "cta_label": "Aanvraag sluiten",
  "cta_note": "",
  "services_heading_pre": "Nog meer",
  "services_heading_accent": "vakmensen",
  "services_heading_post": "nodig?",
  "services_intro": "Via Trustoo vind je ook andere vakmensen die handig kunnen zijn naast een zonnepaneleninstallateur. Vergelijk beoordelingen van anderen en vraag gratis offertes aan.",
  "service1_name": "Thuisbatterij-installateurs",
  "service1_text": "Vraag advies over opslag, capaciteit en aansluiting van een thuisbatterij.",
  "service1_url": "https://trustoo.nl/nederland/thuisbatterij/?utm_source=brevo&utm_campaign=reactivatie_zonnepanelen_mail1&utm_medium=email&utm_content=thuisbatterijcard",
  "service1_link_label": "Bekijk thuisbatterij-installateurs",
  "service1_image_url": "https://img.mailinblue.com/9986607/images/rnb/original/6a99ca90b423db7c1ead99bc.jpg",
  "service1_image_alt": "Thuisbatterij-installateur aan het werk: batterijsysteem aansluiten",
  "service2_name": "Laadpaalinstallateurs",
  "service2_text": "Laat veilig een laadpaal plaatsen die past bij je aansluiting en auto.",
  "service2_url": "https://trustoo.nl/nederland/laadpalen/?utm_source=brevo&utm_campaign=reactivatie_zonnepanelen_mail1&utm_medium=email&utm_content=laadpalencard",
  "service2_link_label": "Bekijk laadpaalinstallateurs",
  "service2_image_url": "https://img.mailinblue.com/9986607/images/rnb/original/6a99ca7ad6d15096d2e48ab6.jpg",
  "service2_image_alt": "Laadpaalinstallateur aan het werk: laadpaal aansluiten",
  "service3_name": "Elektriciens",
  "service3_text": "Schakel een elektricien in voor groepenkasten, stopcontacten en storingen.",
  "service3_url": "https://trustoo.nl/nederland/elektricien/?utm_source=brevo&utm_campaign=reactivatie_zonnepanelen_mail1&utm_medium=email&utm_content=elektriciencard",
  "service3_link_label": "Bekijk elektriciens",
  "service3_image_url": "https://img.mailinblue.com/9986607/images/rnb/original/6a99ca6525aaba004d88df8d.jpg",
  "service3_image_alt": "Elektricien aan het werk: stopcontact of groepenkast aansluiten",
  "closing_heading_pre": "Al geregeld of liever",
  "closing_heading_accent": "opnieuw beginnen?",
  "closing_heading_post": "",
  "closing_intro": "Heb je gevonden wat je zocht? Rond je aanvraag af, zodat bedrijven niet meer hoeven te reageren. Liever opnieuw beginnen? Start een nieuwe aanvraag.",
  "done_link_label": "Aanvraag afronden",
  "new_request_url": "https://trustoo.nl/nederland/zonnepanelen/?utm_source=brevo&utm_campaign=reactivatie_zonnepanelen_mail1&utm_medium=email&utm_content=nieuweaanvraagcta",
  "new_request_label": "Nieuwe aanvraag doen"
}
