{
  "title": "Je aanvraag voor een loopbaancoach staat nog open",
  "subject_line": "Nog op zoek naar een loopbaancoach? Je aanvraag staat nog open",
  "preheader": "Voeg met één klik extra loopbaancoaches toe aan je aanvraag en ontvang nieuwe offertes. Of rond je aanvraag af als je al iemand hebt gevonden.",
  "hero_link_url": "https://trustoo.nl/nederland/loopbaancoach/?utm_source=brevo&utm_campaign=reactivatie_loopbaancoach_mail1&utm_medium=email&utm_content=heroimage",
  "hero_image_url": "https://img.mailinblue.com/9986607/images/rnb/original/6a99ca7bbe55c06bad68f87a.jpg",
  "hero_image_alt": "Loopbaancoach aan het werk: loopbaandoelen bespreken",
  "hero_title_pre": "Je aanvraag voor een",
  "hero_title_accent": "loopbaancoach",
  "hero_title_post": "staat nog open",
  "hero_subtitle": "Een paar maanden geleden zocht je via Trustoo een loopbaancoach. Nog niemand gevonden? Voeg extra loopbaancoaches toe en ontvang nieuwe offertes om te vergelijken.",
  "hero_cta_label": "Ontvang nieuwe offertes",
  "campaign_key": "reactivatie_loopbaancoach_mail1",
  "request_label": "Je openstaande aanvraag",
  "request_service": "Loopbaancoach",
  "request_meta": "Een paar maanden geleden aangevraagd via Trustoo",
  "request_status": "Nog open",
  "cta_label": "Aanvraag sluiten",
  "cta_note": "",
  "services_heading_pre": "Nog meer",
  "services_heading_accent": "vakmensen",
  "services_heading_post": "nodig?",
  "services_intro": "Via Trustoo vind je ook andere vakmensen die handig kunnen zijn naast een loopbaancoach. Vergelijk beoordelingen van anderen en vraag gratis offertes aan.",
  "service1_name": "Coaches",
  "service1_text": "Schakel een coach in voor begeleiding bij doelen, keuzes of veranderingen.",
  "service1_url": "https://trustoo.nl/nederland/coaching/?utm_source=brevo&utm_campaign=reactivatie_loopbaancoach_mail1&utm_medium=email&utm_content=coachingcard",
  "service1_link_label": "Bekijk coaches",
  "service1_image_url": "https://img.mailinblue.com/9986607/images/rnb/original/6aaa43adba6d538d2bee14c9.jpg",
  "service1_image_alt": "Coach aan het werk: gesprek over persoonlijke en professionele doelen",
  "service2_name": "Psychologen",
  "service2_text": "Laat je professioneel begeleiden bij stress, angst, somberheid of andere klachten.",
  "service2_url": "https://trustoo.nl/nederland/psycholoog/?utm_source=brevo&utm_campaign=reactivatie_loopbaancoach_mail1&utm_medium=email&utm_content=psycholoogcard",
  "service2_link_label": "Bekijk psychologen",
  "service2_image_url": "https://img.mailinblue.com/9986607/images/rnb/original/6a99ca85be55c06bad68f87e.jpg",
  "service2_image_alt": "Psycholoog aan het werk: rustig gesprek voeren met cliënt",
  "service3_name": "Personal trainers",
  "service3_text": "Vraag een personal trainer om begeleiding bij kracht, conditie en doelen.",
  "service3_url": "https://trustoo.nl/nederland/personal-trainer/?utm_source=brevo&utm_campaign=reactivatie_loopbaancoach_mail1&utm_medium=email&utm_content=personaltrainercard",
  "service3_link_label": "Bekijk personal trainers",
  "service3_image_url": "https://img.mailinblue.com/9986607/images/rnb/original/6aaa43affd8ef40f6e584547.jpg",
  "service3_image_alt": "Personal trainer aan het werk: klant begeleiden bij krachttraining",
  "closing_heading_pre": "Al geregeld of liever",
  "closing_heading_accent": "opnieuw beginnen?",
  "closing_heading_post": "",
  "closing_intro": "Heb je gevonden wat je zocht? Rond je aanvraag af, zodat bedrijven niet meer hoeven te reageren. Liever opnieuw beginnen? Start een nieuwe aanvraag.",
  "done_link_label": "Aanvraag afronden",
  "new_request_url": "https://trustoo.nl/nederland/loopbaancoach/?utm_source=brevo&utm_campaign=reactivatie_loopbaancoach_mail1&utm_medium=email&utm_content=nieuweaanvraagcta",
  "new_request_label": "Nieuwe aanvraag doen"
}
