{
  "title": "Je aanvraag voor een uitvaartverzorger staat nog open",
  "subject_line": "Nog op zoek naar een uitvaartverzorger? Je aanvraag staat nog open",
  "preheader": "Voeg met één klik extra uitvaartverzorgers toe aan je aanvraag en ontvang nieuwe offertes. Of rond je aanvraag af als je al iemand hebt gevonden.",
  "hero_link_url": "https://trustoo.nl/nederland/uitvaartverzorger/?utm_source=brevo&utm_campaign=reactivatie_uitvaartverzorger_mail1&utm_medium=email&utm_content=heroimage",
  "hero_image_url": "https://img.mailinblue.com/9986607/images/rnb/original/6a99ca9425aaba004d88df9f.jpg",
  "hero_image_alt": "Uitvaartverzorger aan het werk: ceremonieruimte zorgvuldig voorbereiden",
  "hero_title_pre": "Je aanvraag voor een",
  "hero_title_accent": "uitvaartverzorger",
  "hero_title_post": "staat nog open",
  "hero_subtitle": "Een paar maanden geleden zocht je via Trustoo een uitvaartverzorger. Nog niemand gevonden? Voeg extra uitvaartverzorgers toe en ontvang nieuwe offertes om te vergelijken.",
  "hero_cta_label": "Ontvang nieuwe offertes",
  "campaign_key": "reactivatie_uitvaartverzorger_mail1",
  "request_label": "Je openstaande aanvraag",
  "request_service": "Uitvaartverzorger",
  "request_meta": "Een paar maanden geleden aangevraagd via Trustoo",
  "request_status": "Nog open",
  "cta_label": "Vergelijk extra uitvaartverzorgers",
  "cta_note": "Gratis en vrijblijvend. Je bestaande aanvraag blijft staan, je krijgt er alleen meer reacties op.",
  "services_heading_pre": "Nog meer",
  "services_heading_accent": "vakmensen",
  "services_heading_post": "nodig?",
  "services_intro": "Via Trustoo vind je ook andere vakmensen die handig kunnen zijn naast een uitvaartverzorger. Vergelijk beoordelingen van anderen en vraag gratis offertes aan.",
  "service1_name": "Cateraars",
  "service1_text": "Vraag een cateraar om koffie, lunch of een samenzijn na de uitvaart te verzorgen.",
  "service1_url": "https://trustoo.nl/nederland/catering/?utm_source=brevo&utm_campaign=reactivatie_uitvaartverzorger_mail1&utm_medium=email&utm_content=cateringcard",
  "service1_link_label": "Bekijk cateraars",
  "service1_image_url": "https://img.mailinblue.com/9986607/images/rnb/original/6a99ca5fb423db7c1ead99af.jpg",
  "service1_image_alt": "Cateraar aan het werk: gerechten voorbereiden voor evenement",
  "service2_name": "Notarissen",
  "service2_text": "Schakel een notaris in voor testament, nalatenschap en het regelen van de erfenis.",
  "service2_url": "https://trustoo.nl/nederland/notaris/?utm_source=brevo&utm_campaign=reactivatie_uitvaartverzorger_mail1&utm_medium=email&utm_content=notariscard",
  "service2_link_label": "Bekijk notarissen",
  "service2_image_url": "https://img.mailinblue.com/9986607/images/rnb/original/6a99ca8025aaba004d88df94.jpg",
  "service2_image_alt": "Notaris aan het werk: akte bespreken met cliënten",
  "service3_name": "Schoonmaakbedrijven",
  "service3_text": "Laat een woning na een overlijden zorgvuldig en professioneel schoonmaken.",
  "service3_url": "https://trustoo.nl/nederland/schoonmaakbedrijf/?utm_source=brevo&utm_campaign=reactivatie_uitvaartverzorger_mail1&utm_medium=email&utm_content=schoonmaakbedrijfcard",
  "service3_link_label": "Bekijk schoonmaakbedrijven",
  "service3_image_url": "https://img.mailinblue.com/9986607/images/rnb/original/6a99ca84d6d15096d2e48ab9.jpg",
  "service3_image_alt": "Professionele schoonmaker aan het werk: keukenoppervlak grondig reinigen",
  "closing_heading_pre": "Al geregeld of liever",
  "closing_heading_accent": "opnieuw beginnen?",
  "closing_heading_post": "",
  "closing_intro": "Heb je gevonden wat je zocht? Rond je aanvraag af, zodat bedrijven niet meer hoeven te reageren. Liever opnieuw beginnen? Start een nieuwe aanvraag.",
  "done_link_label": "Aanvraag afronden",
  "new_request_url": "https://trustoo.nl/nederland/uitvaartverzorger/?utm_source=brevo&utm_campaign=reactivatie_uitvaartverzorger_mail1&utm_medium=email&utm_content=nieuweaanvraagcta",
  "new_request_label": "Nieuwe aanvraag doen"
}
