{
  "title": "Je aanvraag voor een warmtepompinstallateur staat nog open",
  "subject_line": "Hoe staat het met je warmtepompplannen?",
  "preheader": "Warmtepomp geregeld of nog aan het vergelijken? Ontdek ook cv-installateurs, isolatie en elektra.",
  "hero_link_url": "https://trustoo.nl/nederland/warmtepomp-installateur/?utm_source=brevo&utm_campaign=reactivatie_warmtepomp_installateur_mail1&utm_medium=email&utm_content=heroimage",
  "hero_image_url": "https://img.mailinblue.com/9986607/images/rnb/original/6a99ca9cb423db7c1ead99be.jpg",
  "hero_image_alt": "Warmtepompinstallateur aan het werk: warmtepomp aansluiten",
  "hero_title_pre": "Je aanvraag voor een",
  "hero_title_accent": "warmtepomp",
  "hero_title_post": "staat nog open",
  "hero_subtitle": "Een paar maanden geleden zocht je via Trustoo een warmtepompinstallateur. Nog niemand gevonden? Voeg extra warmtepompinstallateurs toe en ontvang nieuwe offertes om te vergelijken.",
  "hero_cta_label": "Ontvang nieuwe offertes",
  "campaign_key": "reactivatie_warmtepomp_installateur_mail1",
  "request_label": "Je openstaande aanvraag",
  "request_service": "Warmtepompinstallateur",
  "request_meta": "Een paar maanden geleden aangevraagd via Trustoo",
  "request_status": "Nog open",
  "cta_label": "Aanvraag sluiten",
  "cta_note": "",
  "services_heading_pre": "Nog meer",
  "services_heading_accent": "vakmensen",
  "services_heading_post": "nodig?",
  "services_intro": "Via Trustoo vind je ook andere vakmensen die handig kunnen zijn naast een warmtepompinstallateur. Vergelijk beoordelingen van anderen en vraag gratis offertes aan.",
  "service1_name": "Cv-installateurs",
  "service1_text": "Kies een cv-installateur voor onderhoud, reparatie of vervanging van je cv.",
  "service1_url": "https://trustoo.nl/nederland/cv-verwarmings-installateur/?utm_source=brevo&utm_campaign=reactivatie_warmtepomp_installateur_mail1&utm_medium=email&utm_content=cvverwarmingsinstallateurcard",
  "service1_link_label": "Bekijk cv-installateurs",
  "service1_image_url": "https://img.mailinblue.com/9986607/images/rnb/original/6a99ca5ebe55c06bad68f871.jpg",
  "service1_image_alt": "cv-installateur aan het werk: cV-ketel installeren",
  "service2_name": "Isolatiebedrijven",
  "service2_text": "Vraag een isolatiebedrijf om advies over dak-, muur- of vloerisolatie.",
  "service2_url": "https://trustoo.nl/nederland/isolatie/?utm_source=brevo&utm_campaign=reactivatie_warmtepomp_installateur_mail1&utm_medium=email&utm_content=isolatiecard",
  "service2_link_label": "Bekijk isolatiebedrijven",
  "service2_image_url": "https://img.mailinblue.com/9986607/images/rnb/original/6a99ca7725aaba004d88df92.jpg",
  "service2_image_alt": "Isolatiespecialist aan het werk: isolatiemateriaal aanbrengen",
  "service3_name": "Elektriciens",
  "service3_text": "Schakel een elektricien in voor groepenkasten, stopcontacten en storingen.",
  "service3_url": "https://trustoo.nl/nederland/elektricien/?utm_source=brevo&utm_campaign=reactivatie_warmtepomp_installateur_mail1&utm_medium=email&utm_content=elektriciencard",
  "service3_link_label": "Bekijk elektriciens",
  "service3_image_url": "https://img.mailinblue.com/9986607/images/rnb/original/6a99ca6525aaba004d88df8d.jpg",
  "service3_image_alt": "Elektricien aan het werk: stopcontact of groepenkast aansluiten",
  "closing_heading_pre": "Al geregeld of liever",
  "closing_heading_accent": "opnieuw beginnen?",
  "closing_heading_post": "",
  "closing_intro": "Heb je gevonden wat je zocht? Rond je aanvraag af, zodat bedrijven niet meer hoeven te reageren. Liever opnieuw beginnen? Start een nieuwe aanvraag.",
  "done_link_label": "Aanvraag afronden",
  "new_request_url": "https://trustoo.nl/nederland/warmtepomp-installateur/?utm_source=brevo&utm_campaign=reactivatie_warmtepomp_installateur_mail1&utm_medium=email&utm_content=nieuweaanvraagcta",
  "new_request_label": "Nieuwe aanvraag doen"
}
