{
  "title": "Je aanvraag voor opslagruimte staat nog open",
  "subject_line": "Wat moet je nog regelen rond je spullen?",
  "preheader": "Opslag geregeld of nog aan het kijken? Vind ook verhuizers, schoonmakers en klusjesmannen.",
  "hero_link_url": "https://trustoo.nl/nederland/opslag/?utm_source=brevo&utm_campaign=reactivatie_opslag_mail1&utm_medium=email&utm_content=heroimage",
  "hero_image_url": "https://img.mailinblue.com/9986607/images/rnb/original/6a99ca81d6d15096d2e48ab8.jpg",
  "hero_image_alt": "Opslagmedewerker aan het werk: verhuisdozen in opslagunit plaatsen",
  "hero_title_pre": "Je aanvraag voor",
  "hero_title_accent": "opslagruimte",
  "hero_title_post": "staat nog open",
  "hero_subtitle": "Een paar maanden geleden zocht je via Trustoo opslagruimte. Nog niets gevonden? Vergelijk extra opslagruimtes en ontvang nieuwe offertes om te vergelijken.",
  "hero_cta_label": "Ontvang nieuwe offertes",
  "campaign_key": "reactivatie_opslag_mail1",
  "request_label": "Je openstaande aanvraag",
  "request_service": "Opslagruimte",
  "request_meta": "Een paar maanden geleden aangevraagd via Trustoo",
  "request_status": "Nog open",
  "cta_label": "Aanvraag sluiten",
  "cta_note": "",
  "services_heading_pre": "Nog meer",
  "services_heading_accent": "vakmensen",
  "services_heading_post": "nodig?",
  "services_intro": "Via Trustoo vind je ook andere vakmensen die handig kunnen zijn als je opslagruimte zoekt. Vergelijk beoordelingen van anderen en vraag gratis offertes aan.",
  "service1_name": "Verhuisbedrijven",
  "service1_text": "Vraag een verhuisbedrijf om inpakken, vervoeren en verhuizen uit handen te nemen.",
  "service1_url": "https://trustoo.nl/nederland/verhuisbedrijf/?utm_source=brevo&utm_campaign=reactivatie_opslag_mail1&utm_medium=email&utm_content=verhuisbedrijfcard",
  "service1_link_label": "Bekijk verhuisbedrijven",
  "service1_image_url": "https://img.mailinblue.com/9986607/images/rnb/original/6a99ca96d6d15096d2e48abb.jpg",
  "service1_image_alt": "Verhuizer aan het werk: verhuisdoos zorgvuldig naar bus dragen",
  "service2_name": "Schoonmaakbedrijven",
  "service2_text": "Laat je woning grondig schoonmaken voor of na het leeghalen en opslaan.",
  "service2_url": "https://trustoo.nl/nederland/schoonmaakbedrijf/?utm_source=brevo&utm_campaign=reactivatie_opslag_mail1&utm_medium=email&utm_content=schoonmaakbedrijfcard",
  "service2_link_label": "Bekijk schoonmaakbedrijven",
  "service2_image_url": "https://img.mailinblue.com/9986607/images/rnb/original/6a99ca84d6d15096d2e48ab9.jpg",
  "service2_image_alt": "Professionele schoonmaker aan het werk: keukenoppervlak grondig reinigen",
  "service3_name": "Klusjesmannen",
  "service3_text": "Schakel een klusjesman in voor kleine klussen en reparaties in en om het huis.",
  "service3_url": "https://trustoo.nl/nederland/klusjesman/?utm_source=brevo&utm_campaign=reactivatie_opslag_mail1&utm_medium=email&utm_content=klusjesmancard",
  "service3_link_label": "Bekijk klusjesmannen",
  "service3_image_url": "https://img.mailinblue.com/9986607/images/rnb/original/6a99ca7825aaba004d88df93.jpg",
  "service3_image_alt": "Klusjesman aan het werk: kast of plank monteren",
  "closing_heading_pre": "Al geregeld of liever",
  "closing_heading_accent": "opnieuw beginnen?",
  "closing_heading_post": "",
  "closing_intro": "Heb je gevonden wat je zocht? Rond je aanvraag af, zodat bedrijven niet meer hoeven te reageren. Liever opnieuw beginnen? Start een nieuwe aanvraag.",
  "done_link_label": "Aanvraag afronden",
  "new_request_url": "https://trustoo.nl/nederland/opslag/?utm_source=brevo&utm_campaign=reactivatie_opslag_mail1&utm_medium=email&utm_content=nieuweaanvraagcta",
  "new_request_label": "Nieuwe aanvraag doen"
}
