{
  "title": "Je aanvraag voor een webdesigner staat nog open",
  "subject_line": "Wat is de volgende stap voor je website?",
  "preheader": "Webdesigner gevonden of nog aan het kijken? Vind ook online marketing, SEO en grafisch ontwerp.",
  "hero_link_url": "https://trustoo.nl/nederland/webdesign/?utm_source=brevo&utm_campaign=reactivatie_webdesign_mail1&utm_medium=email&utm_content=heroimage",
  "hero_image_url": "https://img.mailinblue.com/9986607/images/rnb/original/6a99ca9dbe55c06bad68f885.jpg",
  "hero_image_alt": "Webdesigner aan het werk: website-interface ontwerpen",
  "hero_title_pre": "Je aanvraag voor een",
  "hero_title_accent": "webdesigner",
  "hero_title_post": "staat nog open",
  "hero_subtitle": "Een paar maanden geleden zocht je via Trustoo een webdesigner. Nog niemand gevonden? Voeg extra webdesigners toe en ontvang nieuwe offertes om te vergelijken.",
  "hero_cta_label": "Ontvang nieuwe offertes",
  "campaign_key": "reactivatie_webdesign_mail1",
  "request_label": "Je openstaande aanvraag",
  "request_service": "Webdesigner",
  "request_meta": "Een paar maanden geleden aangevraagd via Trustoo",
  "request_status": "Nog open",
  "cta_label": "Aanvraag sluiten",
  "cta_note": "",
  "services_heading_pre": "Nog meer",
  "services_heading_accent": "vakmensen",
  "services_heading_post": "nodig?",
  "services_intro": "Via Trustoo vind je ook andere vakmensen die handig kunnen zijn naast een webdesigner. Vergelijk beoordelingen van anderen en vraag gratis offertes aan.",
  "service1_name": "Online marketing bureaus",
  "service1_text": "Schakel een online marketing bureau in voor meer bereik via Google en social media.",
  "service1_url": "https://trustoo.nl/nederland/online-marketing/?utm_source=brevo&utm_campaign=reactivatie_webdesign_mail1&utm_medium=email&utm_content=onlinemarketingcard",
  "service1_link_label": "Bekijk online marketing bureaus",
  "service1_image_url": "https://img.mailinblue.com/9986607/images/content_library/original/69fdbabdc0930e7c615624c1.png",
  "service1_image_alt": "Online marketing bureau aan het werk",
  "service2_name": "SEO-specialisten",
  "service2_text": "Kies een SEO-specialist om je vindbaarheid met techniek en content te verbeteren.",
  "service2_url": "https://trustoo.nl/nederland/seo-specialist/?utm_source=brevo&utm_campaign=reactivatie_webdesign_mail1&utm_medium=email&utm_content=seospecialistcard",
  "service2_link_label": "Bekijk SEO-specialisten",
  "service2_image_url": "https://img.mailinblue.com/9986607/images/content_library/original/69fdbabd23da2f84ec11733c.png",
  "service2_image_alt": "SEO-specialist analyseert data",
  "service3_name": "Grafisch ontwerpers",
  "service3_text": "Vraag een grafisch ontwerper om een logo, huisstijl of ander ontwerp voor je merk.",
  "service3_url": "https://trustoo.nl/nederland/grafisch-ontwerper/?utm_source=brevo&utm_campaign=reactivatie_webdesign_mail1&utm_medium=email&utm_content=grafischontwerpercard",
  "service3_link_label": "Bekijk grafisch ontwerpers",
  "service3_image_url": "https://img.mailinblue.com/9986607/images/content_library/original/69fdbabe23da2f84ec11733d.png",
  "service3_image_alt": "Grafisch ontwerper aan het werk",
  "closing_heading_pre": "Al geregeld of liever",
  "closing_heading_accent": "opnieuw beginnen?",
  "closing_heading_post": "",
  "closing_intro": "Heb je gevonden wat je zocht? Rond je aanvraag af, zodat bedrijven niet meer hoeven te reageren. Liever opnieuw beginnen? Start een nieuwe aanvraag.",
  "done_link_label": "Aanvraag afronden",
  "new_request_url": "https://trustoo.nl/nederland/webdesign/?utm_source=brevo&utm_campaign=reactivatie_webdesign_mail1&utm_medium=email&utm_content=nieuweaanvraagcta",
  "new_request_label": "Nieuwe aanvraag doen"
}
