{
  "title": "Je aanvraag voor een architect staat nog open",
  "subject_line": "Wat is de volgende stap voor je bouwplan?",
  "preheader": "Architect gevonden of nog aan het oriënteren? Van aannemer tot bouwkundige keuring en interieur.",
  "hero_link_url": "https://trustoo.nl/nederland/architect/?utm_source=brevo&utm_campaign=reactivatie_architect_mail1&utm_medium=email&utm_content=heroimage",
  "hero_image_url": "https://img.mailinblue.com/9986607/images/rnb/original/6a99ca56be55c06bad68f86c.jpg",
  "hero_image_alt": "Architect aan het werk: bouwtekeningen bespreken op locatie",
  "hero_title_pre": "Je aanvraag voor een",
  "hero_title_accent": "architect",
  "hero_title_post": "staat nog open",
  "hero_subtitle": "Een paar maanden geleden zocht je via Trustoo een architect. Nog niemand gevonden? Voeg extra architecten toe en ontvang nieuwe offertes om te vergelijken.",
  "hero_cta_label": "Ontvang nieuwe offertes",
  "campaign_key": "reactivatie_architect_mail1",
  "request_label": "Je openstaande aanvraag",
  "request_service": "Architect",
  "request_meta": "Een paar maanden geleden aangevraagd via Trustoo",
  "request_status": "Nog open",
  "cta_label": "Aanvraag sluiten",
  "cta_note": "",
  "services_heading_pre": "Nog meer",
  "services_heading_accent": "vakmensen",
  "services_heading_post": "nodig?",
  "services_intro": "Via Trustoo vind je ook andere vakmensen die handig kunnen zijn naast een architect. Vergelijk beoordelingen van anderen en vraag gratis offertes aan.",
  "service1_name": "Aannemers",
  "service1_text": "Vraag een aannemer om je verbouwing te begeleiden, van planning tot uitvoering.",
  "service1_url": "https://trustoo.nl/nederland/aannemer/?utm_source=brevo&utm_campaign=reactivatie_architect_mail1&utm_medium=email&utm_content=aannemercard",
  "service1_link_label": "Bekijk aannemers",
  "service1_image_url": "https://img.mailinblue.com/9986607/images/rnb/original/6a99ca53be55c06bad68f86a.jpg",
  "service1_image_alt": "Aannemer aan het werk: bouwtekening bekijken tijdens renovatie",
  "service2_name": "Bouwkundige keurders",
  "service2_text": "Schakel een bouwkundige keurder in om een woning onafhankelijk te beoordelen.",
  "service2_url": "https://trustoo.nl/nederland/bouwkundige-keuring/?utm_source=brevo&utm_campaign=reactivatie_architect_mail1&utm_medium=email&utm_content=bouwkundigekeuringcard",
  "service2_link_label": "Bekijk bouwkundig keurders",
  "service2_image_url": "https://img.mailinblue.com/9986607/images/rnb/original/6a99ca5ed6d15096d2e48ab2.jpg",
  "service2_image_alt": "Bouwkundig inspecteur aan het werk: muur en kozijn inspecteren",
  "service3_name": "Interieurstylisten",
  "service3_text": "Kies een interieurstylist voor kleuren, indeling en materialen die goed samengaan.",
  "service3_url": "https://trustoo.nl/nederland/interieurstylist/?utm_source=brevo&utm_campaign=reactivatie_architect_mail1&utm_medium=email&utm_content=interieurstylistcard",
  "service3_link_label": "Bekijk interieurstylisten",
  "service3_image_url": "https://img.mailinblue.com/9986607/images/rnb/original/6a99ca76b423db7c1ead99b3.jpg",
  "service3_image_alt": "Interieurstylist aan het werk: materialen en kleuren presenteren",
  "closing_heading_pre": "Al geregeld of liever",
  "closing_heading_accent": "opnieuw beginnen?",
  "closing_heading_post": "",
  "closing_intro": "Heb je gevonden wat je zocht? Rond je aanvraag af, zodat bedrijven niet meer hoeven te reageren. Liever opnieuw beginnen? Start een nieuwe aanvraag.",
  "done_link_label": "Aanvraag afronden",
  "new_request_url": "https://trustoo.nl/nederland/architect/?utm_source=brevo&utm_campaign=reactivatie_architect_mail1&utm_medium=email&utm_content=nieuweaanvraagcta",
  "new_request_label": "Nieuwe aanvraag doen"
}
