{
  "title": "Je aanvraag voor een fotograaf staat nog open",
  "subject_line": "Wat staat er nog op je lijst voor je event?",
  "preheader": "Fotograaf geregeld of nog aan het kijken? Vind ook een dj, cateraar of videograaf.",
  "hero_link_url": "https://trustoo.nl/nederland/fotograaf/?utm_source=brevo&utm_campaign=reactivatie_fotograaf_mail1&utm_medium=email&utm_content=heroimage",
  "hero_image_url": "https://img.mailinblue.com/9986607/images/rnb/original/6aaa43b0fd8ef40f6e584548.jpg",
  "hero_image_alt": "Fotograaf aan het werk: familieshoot in de studio",
  "hero_title_pre": "Je aanvraag voor een",
  "hero_title_accent": "fotograaf",
  "hero_title_post": "staat nog open",
  "hero_subtitle": "Een paar maanden geleden zocht je via Trustoo een fotograaf. Nog niemand gevonden? Voeg extra fotografen toe en ontvang nieuwe offertes om te vergelijken.",
  "hero_cta_label": "Ontvang nieuwe offertes",
  "campaign_key": "reactivatie_fotograaf_mail1",
  "request_label": "Je openstaande aanvraag",
  "request_service": "Fotograaf",
  "request_meta": "Een paar maanden geleden aangevraagd via Trustoo",
  "request_status": "Nog open",
  "cta_label": "Aanvraag sluiten",
  "cta_note": "",
  "services_heading_pre": "Nog meer",
  "services_heading_accent": "vakmensen",
  "services_heading_post": "nodig?",
  "services_intro": "Via Trustoo vind je ook andere vakmensen die handig kunnen zijn naast een fotograaf. Vergelijk beoordelingen van anderen en vraag gratis offertes aan.",
  "service1_name": "Dj's",
  "service1_text": "Kies een dj die met passende muziek de juiste sfeer neerzet op je evenement.",
  "service1_url": "https://trustoo.nl/nederland/dj/?utm_source=brevo&utm_campaign=reactivatie_fotograaf_mail1&utm_medium=email&utm_content=djcard",
  "service1_link_label": "Bekijk dj's",
  "service1_image_url": "https://img.mailinblue.com/9986607/images/rnb/original/6a99ca6125aaba004d88df8c.jpg",
  "service1_image_alt": "dj aan het werk: draaitafel en apparatuur bedienen",
  "service2_name": "Cateraars",
  "service2_text": "Vraag catering aan voor hapjes, lunch, diner of een buffet op je evenement.",
  "service2_url": "https://trustoo.nl/nederland/catering/?utm_source=brevo&utm_campaign=reactivatie_fotograaf_mail1&utm_medium=email&utm_content=cateringcard",
  "service2_link_label": "Bekijk cateraars",
  "service2_image_url": "https://img.mailinblue.com/9986607/images/rnb/original/6a99ca5fb423db7c1ead99af.jpg",
  "service2_image_alt": "Cateraar aan het werk: gerechten voorbereiden voor evenement",
  "service3_name": "Videografen",
  "service3_text": "Laat de sfeer en hoogtepunten van je evenement professioneel op video vastleggen.",
  "service3_url": "https://trustoo.nl/nederland/videograaf/?utm_source=brevo&utm_campaign=reactivatie_fotograaf_mail1&utm_medium=email&utm_content=videograafcard",
  "service3_link_label": "Bekijk videografen",
  "service3_image_url": "https://img.mailinblue.com/9986607/images/rnb/original/6a99ca99be55c06bad68f882.jpg",
  "service3_image_alt": "Videograaf aan het werk: professionele camera bedienen",
  "closing_heading_pre": "Al geregeld of liever",
  "closing_heading_accent": "opnieuw beginnen?",
  "closing_heading_post": "",
  "closing_intro": "Heb je gevonden wat je zocht? Rond je aanvraag af, zodat bedrijven niet meer hoeven te reageren. Liever opnieuw beginnen? Start een nieuwe aanvraag.",
  "done_link_label": "Aanvraag afronden",
  "new_request_url": "https://trustoo.nl/nederland/fotograaf/?utm_source=brevo&utm_campaign=reactivatie_fotograaf_mail1&utm_medium=email&utm_content=nieuweaanvraagcta",
  "new_request_label": "Nieuwe aanvraag doen"
}
