{
  "title": "Je aanvraag voor een cv-installateur staat nog open",
  "subject_line": "Nog op zoek naar een cv-installateur? Je aanvraag staat nog open",
  "preheader": "Voeg met één klik extra cv-installateurs toe aan je aanvraag en ontvang nieuwe offertes. Of rond je aanvraag af als je al iemand hebt gevonden.",
  "hero_link_url": "https://trustoo.nl/nederland/cv-verwarmings-installateur/?utm_source=brevo&utm_campaign=reactivatie_cv_verwarmings_installateur_mail1&utm_medium=email&utm_content=heroimage",
  "hero_image_url": "https://img.mailinblue.com/9986607/images/rnb/original/6a99ca5ebe55c06bad68f871.jpg",
  "hero_image_alt": "cv-installateur aan het werk: cV-ketel installeren",
  "hero_title_pre": "Je aanvraag voor een",
  "hero_title_accent": "cv-installateur",
  "hero_title_post": "staat nog open",
  "hero_subtitle": "Een paar maanden geleden zocht je via Trustoo een cv-installateur. Nog niemand gevonden? Voeg extra cv-installateurs toe en ontvang nieuwe offertes om te vergelijken.",
  "hero_cta_label": "Ontvang nieuwe offertes",
  "campaign_key": "reactivatie_cv_verwarmings_installateur_mail1",
  "request_label": "Je openstaande aanvraag",
  "request_service": "Cv-installateur",
  "request_meta": "Een paar maanden geleden aangevraagd via Trustoo",
  "request_status": "Nog open",
  "cta_label": "Vergelijk extra cv-installateurs",
  "cta_note": "Gratis en vrijblijvend. Je bestaande aanvraag blijft staan, je krijgt er alleen meer reacties op.",
  "services_heading_pre": "Nog meer",
  "services_heading_accent": "vakmensen",
  "services_heading_post": "nodig?",
  "services_intro": "Via Trustoo vind je ook andere vakmensen die handig kunnen zijn naast een cv-installateur. Vergelijk beoordelingen van anderen en vraag gratis offertes aan.",
  "service1_name": "Loodgieters",
  "service1_text": "Kies een loodgieter voor lekkage, verstopping, leidingwerk of nieuw sanitair.",
  "service1_url": "https://trustoo.nl/nederland/loodgieter/?utm_source=brevo&utm_campaign=reactivatie_cv_verwarmings_installateur_mail1&utm_medium=email&utm_content=loodgietercard",
  "service1_link_label": "Bekijk loodgieters",
  "service1_image_url": "https://img.mailinblue.com/9986607/images/rnb/original/6a99ca7aacfba11dfcf18786.jpg",
  "service1_image_alt": "Loodgieter aan het werk: leidingen aansluiten onder wastafel",
  "service2_name": "Warmtepompinstallateurs",
  "service2_text": "Laat een warmtepomp plaatsen die past bij je woning en energieverbruik.",
  "service2_url": "https://trustoo.nl/nederland/warmtepomp-installateur/?utm_source=brevo&utm_campaign=reactivatie_cv_verwarmings_installateur_mail1&utm_medium=email&utm_content=warmtepompinstallateurcard",
  "service2_link_label": "Bekijk warmtepompinstallateurs",
  "service2_image_url": "https://img.mailinblue.com/9986607/images/rnb/original/6a99ca9cb423db7c1ead99be.jpg",
  "service2_image_alt": "Warmtepompinstallateur aan het werk: warmtepomp aansluiten",
  "service3_name": "Isolatiebedrijven",
  "service3_text": "Vraag een isolatiebedrijf om advies over dak-, muur- of vloerisolatie.",
  "service3_url": "https://trustoo.nl/nederland/isolatie/?utm_source=brevo&utm_campaign=reactivatie_cv_verwarmings_installateur_mail1&utm_medium=email&utm_content=isolatiecard",
  "service3_link_label": "Bekijk isolatiebedrijven",
  "service3_image_url": "https://img.mailinblue.com/9986607/images/rnb/original/6a99ca7725aaba004d88df92.jpg",
  "service3_image_alt": "Isolatiespecialist aan het werk: isolatiemateriaal aanbrengen",
  "closing_heading_pre": "Al geregeld of liever",
  "closing_heading_accent": "opnieuw beginnen?",
  "closing_heading_post": "",
  "closing_intro": "Heb je gevonden wat je zocht? Rond je aanvraag af, zodat bedrijven niet meer hoeven te reageren. Liever opnieuw beginnen? Start een nieuwe aanvraag.",
  "done_link_label": "Aanvraag afronden",
  "new_request_url": "https://trustoo.nl/nederland/cv-verwarmings-installateur/?utm_source=brevo&utm_campaign=reactivatie_cv_verwarmings_installateur_mail1&utm_medium=email&utm_content=nieuweaanvraagcta",
  "new_request_label": "Nieuwe aanvraag doen"
}
