{
  "title": "Je aanvraag voor een timmerman staat nog open",
  "subject_line": "Welke klus komt hierna in je huis?",
  "preheader": "Timmerwerk geregeld of nog aan het kijken? Vind ook aannemers, stukadoors en schilders.",
  "hero_link_url": "https://trustoo.nl/nederland/timmerman/?utm_source=brevo&utm_campaign=reactivatie_timmerman_mail1&utm_medium=email&utm_content=heroimage",
  "hero_image_url": "https://img.mailinblue.com/9986607/images/rnb/original/6a99ca9025aaba004d88df9d.jpg",
  "hero_image_alt": "Timmerman aan het werk: houten constructie op maat maken",
  "hero_title_pre": "Je aanvraag voor een",
  "hero_title_accent": "timmerman",
  "hero_title_post": "staat nog open",
  "hero_subtitle": "Een paar maanden geleden zocht je via Trustoo een timmerman. Nog niemand gevonden? Voeg extra timmermannen toe en ontvang nieuwe offertes om te vergelijken.",
  "hero_cta_label": "Ontvang nieuwe offertes",
  "campaign_key": "reactivatie_timmerman_mail1",
  "request_label": "Je openstaande aanvraag",
  "request_service": "Timmerman",
  "request_meta": "Een paar maanden geleden aangevraagd via Trustoo",
  "request_status": "Nog open",
  "cta_label": "Aanvraag sluiten",
  "cta_note": "",
  "services_heading_pre": "Nog meer",
  "services_heading_accent": "vakmensen",
  "services_heading_post": "nodig?",
  "services_intro": "Via Trustoo vind je ook andere vakmensen die handig kunnen zijn naast een timmerman. Vergelijk beoordelingen van anderen en vraag gratis offertes aan.",
  "service1_name": "Aannemers",
  "service1_text": "Vraag een aannemer om je verbouwing te begeleiden, van planning tot uitvoering.",
  "service1_url": "https://trustoo.nl/nederland/aannemer/?utm_source=brevo&utm_campaign=reactivatie_timmerman_mail1&utm_medium=email&utm_content=aannemercard",
  "service1_link_label": "Bekijk aannemers",
  "service1_image_url": "https://img.mailinblue.com/9986607/images/rnb/original/6a99ca53be55c06bad68f86a.jpg",
  "service1_image_alt": "Aannemer aan het werk: bouwtekening bekijken tijdens renovatie",
  "service2_name": "Stukadoors",
  "service2_text": "Maak muren en plafonds strak met stucwerk als goede basis voor verf of behang.",
  "service2_url": "https://trustoo.nl/nederland/stukadoor/?utm_source=brevo&utm_campaign=reactivatie_timmerman_mail1&utm_medium=email&utm_content=stukadoorcard",
  "service2_link_label": "Bekijk stukadoors",
  "service2_image_url": "https://img.mailinblue.com/9986607/images/rnb/original/6a99ca8db423db7c1ead99ba.jpg",
  "service2_image_alt": "Stukadoor aan het werk: wand glad stucen",
  "service3_name": "Schilders",
  "service3_text": "Laat binnen- of buitenschilderwerk netjes en duurzaam uitvoeren door een vakman.",
  "service3_url": "https://trustoo.nl/nederland/schilder/?utm_source=brevo&utm_campaign=reactivatie_timmerman_mail1&utm_medium=email&utm_content=schildercard",
  "service3_link_label": "Bekijk schilders",
  "service3_image_url": "https://img.mailinblue.com/9986607/images/rnb/original/6aaa43aa0b0c510d795d8951.jpg",
  "service3_image_alt": "Schilder aan het werk: binnenmuur schilderen met een verfroller",
  "closing_heading_pre": "Al geregeld of liever",
  "closing_heading_accent": "opnieuw beginnen?",
  "closing_heading_post": "",
  "closing_intro": "Heb je gevonden wat je zocht? Rond je aanvraag af, zodat bedrijven niet meer hoeven te reageren. Liever opnieuw beginnen? Start een nieuwe aanvraag.",
  "done_link_label": "Aanvraag afronden",
  "new_request_url": "https://trustoo.nl/nederland/timmerman/?utm_source=brevo&utm_campaign=reactivatie_timmerman_mail1&utm_medium=email&utm_content=nieuweaanvraagcta",
  "new_request_label": "Nieuwe aanvraag doen"
}
