{
  "title": "Je aanvraag voor een verkoopmakelaar staat nog open",
  "subject_line": "Wat is de volgende stap bij je huisverkoop?",
  "preheader": "Makelaar gevonden of nog aan het vergelijken? Van aankoopmakelaar tot taxatie en notaris.",
  "hero_link_url": "https://trustoo.nl/nederland/verkoopmakelaar/?utm_source=brevo&utm_campaign=reactivatie_verkoopmakelaar_mail1&utm_medium=email&utm_content=heroimage",
  "hero_image_url": "https://img.mailinblue.com/9986607/images/rnb/original/6a99ca97be55c06bad68f880.jpg",
  "hero_image_alt": "Verkoopmakelaar aan het werk: woning voorbereiden voor bezichtiging",
  "hero_title_pre": "Je aanvraag voor een",
  "hero_title_accent": "verkoopmakelaar",
  "hero_title_post": "staat nog open",
  "hero_subtitle": "Een paar maanden geleden zocht je via Trustoo een verkoopmakelaar. Nog niemand gevonden? Voeg extra verkoopmakelaars toe en ontvang nieuwe offertes om te vergelijken.",
  "hero_cta_label": "Ontvang nieuwe offertes",
  "campaign_key": "reactivatie_verkoopmakelaar_mail1",
  "request_label": "Je openstaande aanvraag",
  "request_service": "Verkoopmakelaar",
  "request_meta": "Een paar maanden geleden aangevraagd via Trustoo",
  "request_status": "Nog open",
  "cta_label": "Aanvraag sluiten",
  "cta_note": "",
  "services_heading_pre": "Nog meer",
  "services_heading_accent": "vakmensen",
  "services_heading_post": "nodig?",
  "services_intro": "Via Trustoo vind je ook andere vakmensen die handig kunnen zijn naast een verkoopmakelaar. Vergelijk beoordelingen van anderen en vraag gratis offertes aan.",
  "service1_name": "Aankoopmakelaars",
  "service1_text": "Kies een aankoopmakelaar voor hulp bij zoeken, bieden en onderhandelen.",
  "service1_url": "https://trustoo.nl/nederland/aankoopmakelaar/?utm_source=brevo&utm_campaign=reactivatie_verkoopmakelaar_mail1&utm_medium=email&utm_content=aankoopmakelaarcard",
  "service1_link_label": "Bekijk aankoopmakelaars",
  "service1_image_url": "https://img.mailinblue.com/9986607/images/rnb/original/6a99ca52be55c06bad68f869.jpg",
  "service1_image_alt": "Aankoopmakelaar aan het werk: woning inspecteren met kopers",
  "service2_name": "Taxateurs",
  "service2_text": "Vraag een onafhankelijk gevalideerd taxatierapport aan voor koop of hypotheek.",
  "service2_url": "https://trustoo.nl/nederland/taxateur/?utm_source=brevo&utm_campaign=reactivatie_verkoopmakelaar_mail1&utm_medium=email&utm_content=taxateurcard",
  "service2_link_label": "Bekijk taxateurs",
  "service2_image_url": "https://img.mailinblue.com/9986607/images/rnb/original/6a99ca9eb423db7c1ead99c0.jpg",
  "service2_image_alt": "Woningtaxateur aan het werk: woning opnemen en notities maken",
  "service3_name": "Notarissen",
  "service3_text": "Schakel een notaris in om afspraken over testament, erfenis of woning vast te leggen.",
  "service3_url": "https://trustoo.nl/nederland/notaris/?utm_source=brevo&utm_campaign=reactivatie_verkoopmakelaar_mail1&utm_medium=email&utm_content=notariscard",
  "service3_link_label": "Bekijk notarissen",
  "service3_image_url": "https://img.mailinblue.com/9986607/images/rnb/original/6a99ca8025aaba004d88df94.jpg",
  "service3_image_alt": "Notaris aan het werk: akte bespreken met cliënten",
  "closing_heading_pre": "Al geregeld of liever",
  "closing_heading_accent": "opnieuw beginnen?",
  "closing_heading_post": "",
  "closing_intro": "Heb je gevonden wat je zocht? Rond je aanvraag af, zodat bedrijven niet meer hoeven te reageren. Liever opnieuw beginnen? Start een nieuwe aanvraag.",
  "done_link_label": "Aanvraag afronden",
  "new_request_url": "https://trustoo.nl/nederland/verkoopmakelaar/?utm_source=brevo&utm_campaign=reactivatie_verkoopmakelaar_mail1&utm_medium=email&utm_content=nieuweaanvraagcta",
  "new_request_label": "Nieuwe aanvraag doen"
}
