{
  "title": "Je aanvraag voor een kozijnspecialist staat nog open",
  "subject_line": "Wat is de volgende stap voor je ramen en kozijnen?",
  "preheader": "Kozijnen geregeld of nog aan het vergelijken? Ontdek ook glaszetters, isolatie en schilderwerk.",
  "hero_link_url": "https://trustoo.nl/nederland/kozijnen/?utm_source=brevo&utm_campaign=reactivatie_kozijnen_mail1&utm_medium=email&utm_content=heroimage",
  "hero_image_url": "https://img.mailinblue.com/9986607/images/rnb/original/6a99ca79acfba11dfcf18785.jpg",
  "hero_image_alt": "Kozijnspecialist aan het werk: nieuw kozijn monteren",
  "hero_title_pre": "Je aanvraag voor een",
  "hero_title_accent": "kozijnspecialist",
  "hero_title_post": "staat nog open",
  "hero_subtitle": "Een paar maanden geleden zocht je via Trustoo een kozijnspecialist. Nog niemand gevonden? Voeg extra kozijnspecialisten toe en ontvang nieuwe offertes om te vergelijken.",
  "hero_cta_label": "Ontvang nieuwe offertes",
  "campaign_key": "reactivatie_kozijnen_mail1",
  "request_label": "Je openstaande aanvraag",
  "request_service": "Kozijnspecialist",
  "request_meta": "Een paar maanden geleden aangevraagd via Trustoo",
  "request_status": "Nog open",
  "cta_label": "Aanvraag sluiten",
  "cta_note": "",
  "services_heading_pre": "Nog meer",
  "services_heading_accent": "vakmensen",
  "services_heading_post": "nodig?",
  "services_intro": "Via Trustoo vind je ook andere vakmensen die handig kunnen zijn naast een kozijnspecialist. Vergelijk beoordelingen van anderen en vraag gratis offertes aan.",
  "service1_name": "Glaszetters",
  "service1_text": "Kies een glaszetter voor gebroken ruiten, isolatieglas of nieuw glas in kozijnen.",
  "service1_url": "https://trustoo.nl/nederland/glaszetter/?utm_source=brevo&utm_campaign=reactivatie_kozijnen_mail1&utm_medium=email&utm_content=glaszettercard",
  "service1_link_label": "Bekijk glaszetters",
  "service1_image_url": "https://img.mailinblue.com/9986607/images/rnb/original/6a99ca70be55c06bad68f874.jpg",
  "service1_image_alt": "Glaszetter aan het werk: nieuwe ruit in kozijn plaatsen",
  "service2_name": "Isolatiebedrijven",
  "service2_text": "Vraag een isolatiebedrijf om advies over dak-, muur- of vloerisolatie.",
  "service2_url": "https://trustoo.nl/nederland/isolatie/?utm_source=brevo&utm_campaign=reactivatie_kozijnen_mail1&utm_medium=email&utm_content=isolatiecard",
  "service2_link_label": "Bekijk isolatiebedrijven",
  "service2_image_url": "https://img.mailinblue.com/9986607/images/rnb/original/6a99ca7725aaba004d88df92.jpg",
  "service2_image_alt": "Isolatiespecialist aan het werk: isolatiemateriaal aanbrengen",
  "service3_name": "Schilders",
  "service3_text": "Laat binnen- of buitenschilderwerk netjes en duurzaam uitvoeren door een vakman.",
  "service3_url": "https://trustoo.nl/nederland/schilder/?utm_source=brevo&utm_campaign=reactivatie_kozijnen_mail1&utm_medium=email&utm_content=schildercard",
  "service3_link_label": "Bekijk schilders",
  "service3_image_url": "https://img.mailinblue.com/9986607/images/rnb/original/6aaa43aa0b0c510d795d8951.jpg",
  "service3_image_alt": "Schilder aan het werk: binnenmuur schilderen met een verfroller",
  "closing_heading_pre": "Al geregeld of liever",
  "closing_heading_accent": "opnieuw beginnen?",
  "closing_heading_post": "",
  "closing_intro": "Heb je gevonden wat je zocht? Rond je aanvraag af, zodat bedrijven niet meer hoeven te reageren. Liever opnieuw beginnen? Start een nieuwe aanvraag.",
  "done_link_label": "Aanvraag afronden",
  "new_request_url": "https://trustoo.nl/nederland/kozijnen/?utm_source=brevo&utm_campaign=reactivatie_kozijnen_mail1&utm_medium=email&utm_content=nieuweaanvraagcta",
  "new_request_label": "Nieuwe aanvraag doen"
}
