{
  "title": "Je aanvraag voor een belastingadviseur staat nog open",
  "subject_line": "Hoe wil je je financiën verder regelen?",
  "preheader": "Belastingadvies geregeld of nog op zoek? Ontdek ook boekhouders, accountants en financieel advies.",
  "hero_link_url": "https://trustoo.nl/nederland/belastingadviseur/?utm_source=brevo&utm_campaign=reactivatie_belastingadviseur_mail1&utm_medium=email&utm_content=heroimage",
  "hero_image_url": "https://img.mailinblue.com/9986607/images/rnb/original/6a99ca5925aaba004d88df8b.jpg",
  "hero_image_alt": "Belastingadviseur aan het werk: belastingdocumenten uitleggen",
  "hero_title_pre": "Je aanvraag voor een",
  "hero_title_accent": "belastingadviseur",
  "hero_title_post": "staat nog open",
  "hero_subtitle": "Een paar maanden geleden zocht je via Trustoo een belastingadviseur. Nog niemand gevonden? Voeg extra belastingadviseurs toe en ontvang nieuwe offertes om te vergelijken.",
  "hero_cta_label": "Ontvang nieuwe offertes",
  "campaign_key": "reactivatie_belastingadviseur_mail1",
  "request_label": "Je openstaande aanvraag",
  "request_service": "Belastingadviseur",
  "request_meta": "Een paar maanden geleden aangevraagd via Trustoo",
  "request_status": "Nog open",
  "cta_label": "Aanvraag sluiten",
  "cta_note": "",
  "services_heading_pre": "Nog meer",
  "services_heading_accent": "vakmensen",
  "services_heading_post": "nodig?",
  "services_intro": "Via Trustoo vind je ook andere vakmensen die handig kunnen zijn naast een belastingadviseur. Vergelijk beoordelingen van anderen en vraag gratis offertes aan.",
  "service1_name": "Boekhouders",
  "service1_text": "Laat je administratie en aangiftes verzorgen en houd financieel overzicht.",
  "service1_url": "https://trustoo.nl/nederland/boekhouder/?utm_source=brevo&utm_campaign=reactivatie_belastingadviseur_mail1&utm_medium=email&utm_content=boekhoudercard",
  "service1_link_label": "Bekijk boekhouders",
  "service1_image_url": "https://img.mailinblue.com/9986607/images/rnb/original/6a99ca5cbe55c06bad68f870.jpg",
  "service1_image_alt": "Boekhouder aan het werk: administratie doornemen met ondernemer",
  "service2_name": "Accountants",
  "service2_text": "Schakel een accountant in voor je jaarrekening, aangiftes en financieel advies.",
  "service2_url": "https://trustoo.nl/nederland/accountant/?utm_source=brevo&utm_campaign=reactivatie_belastingadviseur_mail1&utm_medium=email&utm_content=accountantcard",
  "service2_link_label": "Bekijk accountants",
  "service2_image_url": "https://img.mailinblue.com/9986607/images/rnb/original/6a99ca53acfba11dfcf1877e.jpg",
  "service2_image_alt": "Accountant aan het werk: financiële cijfers bespreken met klant",
  "service3_name": "Financieel adviseurs",
  "service3_text": "Vraag een financieel adviseur om onafhankelijk advies over pensioen en vermogen.",
  "service3_url": "https://trustoo.nl/nederland/financieel-adviseur/?utm_source=brevo&utm_campaign=reactivatie_belastingadviseur_mail1&utm_medium=email&utm_content=financieeladviseurcard",
  "service3_link_label": "Bekijk financieel adviseurs",
  "service3_image_url": "https://img.mailinblue.com/9986607/images/rnb/original/6a99ca67b423db7c1ead99b1.jpg",
  "service3_image_alt": "Financieel adviseur aan het werk: financieel plan uitleggen aan klant",
  "closing_heading_pre": "Al geregeld of liever",
  "closing_heading_accent": "opnieuw beginnen?",
  "closing_heading_post": "",
  "closing_intro": "Heb je gevonden wat je zocht? Rond je aanvraag af, zodat bedrijven niet meer hoeven te reageren. Liever opnieuw beginnen? Start een nieuwe aanvraag.",
  "done_link_label": "Aanvraag afronden",
  "new_request_url": "https://trustoo.nl/nederland/belastingadviseur/?utm_source=brevo&utm_campaign=reactivatie_belastingadviseur_mail1&utm_medium=email&utm_content=nieuweaanvraagcta",
  "new_request_label": "Nieuwe aanvraag doen"
}
